usertoken,treatment,mid1,mid2
UjjJWjHQ,barchart,"I looked for the lowest and the highest rates of return for each graph. Some were worth putting 100% because the odds were very good that, at minimum, I wouldn't lose money. I also considered, somewhat, the consistency of the returns and took that into account. ",I first looked at the consistency and then the highest and lowest rates of return for each. I am open to some risk but not high risk so if there was high risk of loss then I would scale back on that fund a little more than low risk of loss or low risk of smaller loss. 
ERx33R94,point,I was looking for at least 50% of the returns to be higher in one where I gave it higher weighting. The higher returns were worth the extra risk in some cases. ,"I found these not as useful. I looked for ones that had the least spread into the negative regions. However, these plots do not tell you anything about the relative probability of falling within this range, unlike the first one. Thus, my aim here was to preserve the investment."
n2ToGPvU,dotplot,"I looked for the general trends of return rates across the 30-year period. Additionally, I looked at the range of values displayed as even if all rates across the 30 years produced positive returns, it may be at the expense of a small return rate. ","I again looked at the distributions of the data points although this time it was more difficult to tell. In addition to the distribution of the data, I again looked at the general range of return rates. "
pTQ62b0l,dotplot,I mainly chose the fund that had the highest returns. I figured this out by looking at the graphs. ,I chose the chart with the highest returns. I looked where the dots were. 
M2wTjbSE,point,"I looked at the charts to see which funds had greater variances and greater chances to earn more over the long term.  Because I was investing for 30 years, I chose the more volatile options, since I assumed they would be able to have larger gains because of the long time period.","Using this visual, I was able to easily see which fund had a better average return over time, because it was illustrated nicely in this type of graph.  In this case, I always chose the fund with the higher average return."
HJs83Q8g,interval,I tried to balance risk a small amount but mostly looked at the average rate of return.,I went with the middle of the dark green and tried to put most of my investments in whichever was higher. 
8dTEvjO4,hopsdist,I tried to look for where I could get the most gain with the right amount of risk and being able to see visually the chance to take a loss vs gain really helped me tell which one was better,I just looked for where i could potentially get the highest gains but then checked how many lines were in the negative to see if it was worth the risk
KWDgbGm4,interval,"I looked at what the highest possible rate of return was, the lowest rate of return, and what the 'average' return would be between all 33 results. I also tried to narrow down by which fund had the fewest number of possible negative returns.",I looked more closely at the dark green bar and it's 66% chance of occurring between both funds. I tried to hedge my investments between both funds when there was the possibility for a large negative return.
UJcVd2TG,hops,I wanted the highest returns no matter the risk. I saw the charts and decided to go with the highest returns.,I wanted the highest returns. I went with the biggest risk.
ApM8otwl,hopsdist,"I looked at the lowest %age and then compared the growth over time. The chart with the best average growth over the time period was the one I allocated the larger portion of my investment in. I did always keep my money divided between the two funds, never giving one my entire investment. Never put all your eggs in one basket is a proven theory.","First, the orange line got me dizzy. I did not like this visualization at all. However, I chose the fund with the least fluctuation unless the more activity was situated in the higher range of growth. "
6AXFCdZ9,interval,"i looked at the best possible outcome between each chat and the worst and then invest more on the one that has higher tendency of higher return, but then invest a substantial amount that would cover losses if option a go sideway",i focus on the dark grey of each chart and determine which one is more safer and would yield better return
CWm8UHdR,point,"I looked at the top grotwh rate, the middle range, and then the total percent chance above 0. Overall I tried to find the highest expected value of each. ","For the most part I just used the average / midpoint, but I did also consider the lowest end of the range on trials that had a broad range. "
qEtWBV4q,dotplot,I looked at the relative stability of each (whether one had a high risk of loss) and at the highest possible return and tried to diversify in such a way to create near-guaranteed return but also the possibility of higher return.,"Same concept, it's just a matter of reading the new type of chart, with negatives and positives and the height of the bars as stacks of dots now."
990j0a1g,dotplot,"i dont understand charts, so i go to the last sections to see the higher bars and decide",looked to the higher bars on each section so i could at least try to know the best return rate
i1ThzWu9,barchart,"i looked at the final results of the charts (the percentage) so i could choose which one seemed the best. I dont understand much of charts, so i tried my best by visualization only",i looked for the best and highest bar rates on both charts so i could try to find the best return rate
3HTa4C3w,dotplot,"i tried to see the last positions, the higher bars, to make a decisison since they seemed to be the ones with higher return rates.",i visualized the higher bars to see the higher return rates
f2gacKfC,point,"LOOKED AT THE LAST RESULTS, WHERE IS WAS SAID TO HAVE THE HIGHER RETURN RATE",I LOOKED INTO THE INSTRUCTION AND FOUND OUT THE PLACE WHERE THE BEST RETURN RATE WAS AND CHOOSE THERE.
MDgpushP,hops,"I looked to see which had more positive and higher bars. I then looked how many bars were negative. If all were positive I went with the investment with higher bars. If one had more negative bars but had higher positive bars, then I would allocate must but take away some percentage based on how many negative bars.",I looked to see how often the bars stayed left or right relative to each other. I then looked at how drastic the change in the bars position was. If one bar was ahead of the other bar I would choose more of that investment. If they bounced around a lot I would try to average their positions.
g1VQzaaH,point,I used the charts to compare returns for each time frame for the funds. I looked at the midpoint to estimate what funds would have the highest compounding interest at that point.,I used the midpoint to see the average rate of return. I looked at the range and the evaluation period to see how big of a sample size I could find.
I4DYQ30E,barchart,"I looked at the overall returns, the longevity of returns and the amount of losses incurred.",I looked at the amount of returns and how they compared to each other. I looked at the amount of negative returns. 
7oAfixKC,density,What the highest and lowest values were. I tried to guess what the predicted value would be over 30 years for each chart based on the possible yearly returns. I generally was swayed by charts that had the highest possible returns.,I tried to visually predict what would be the mean return over 30 years based on the distribution. 
xDD5eppb,point,I looked at which seemed to grow the best relative to the duration and between any lows and highs per.,"I found these charts a little more challenging to get use to, but I used them in a similar way, to determine the acceleration of the rate of return and any fluctuation or how stable they were for the entire timeframe listed (ie X years)"
8ObNrSLP,hops,I tried to choose the one that showed the greatest amount of return for the lesser risk. ,"I used my same method as before, but tried to pay close attention to the orange lines and see what their ranges were."
EQKY3iUK,hopsdist,"I always tried to look at the best return rate at the end, just after seeing if there was a big loss rate at the beginning and making an estimate of the values I would win.",I looked at where the orange line went at both ends and checked which was the most advantageous and which could give me the most damage.
F9sXiaez,barchart,I looked at the risk and amount of possible losses to make my decision ,tried to reduce my potential of loss and increase my chance of gains
WpvHJU0u,barchart,I looked for lower ratesof losses and higher rates of gains.,I looked for lower losses and higher gains and less variation.
7EoLeJB8,barchart,"Whichever looked like it would give better returns long term, I put all of most there. High returns being bars that reached closer to the top of the graph, of course.","Again, I looked for higher bars..even if there were initial losses, as long as I didn't get nervous and withdraw money, the higher overall returns would compensate for those."
N1Sd7DgS,barchart,I put the mouse over the percentages to observe the obtained results to generate an opinion of which would be better,I used the reasoning in the same way as before
bvD5GSTE,hopsdist,I tried to look how much I would be receiving after the time... and just put all my money in the chart that looks like I would win more money.,I saw if the orange bars were concentrated in which numbers and which year was asked and looked which one paid more.
9ELOvUK7,barchart,"First I looked to see which one would be more profitable on average and tried to judge how much more profitable. I next considered consistency, how likely it would be that I achieve a favorable rate of return and even a positive rate of return. Based on these factors, I tried to balance reward vs risk and allocate accordingly. I tended to invest more with the aggressive fund in order to maximize profits, but still invested some with the other fund to hedge my gamble.","I first assessed the average profitability of the funds. I next considered the consistency, how likely a favorable outcome was going to occur versus a low rate of return or negative rate of return. Based on these two factors, I tried to weigh the rewards vs the risks and come up with an aggressive percentage while still having some protection by investing in the other fund as a hedge."
J68xlxT0,density,look for current and past trends when making decsions,"look at past, present, peaks, trends and decided on decision."
6bPeDxK2,point,I tried to average the percentage of increase and then figure which ones to be more aggressive and which to be more conservative with.,I tried to weigh how much loss one fund would generate and put more money in the opposite option.
